{
  "schema_version": 1,
  "time_zone": "UTC",
  "updated_at": "2026-10-02T03:53:00Z",
  "recipes": {
    "local-recipes/glm-5.3-flash-ud-iq3-xxs.yaml": {
      "source": "local",
      "recipe_path": "local-recipes/glm-5.3-flash-ud-iq3-xxs.yaml",
      "recipe_name": "GLM-5.3-Flash-UD-IQ3_XXS",
      "model": "unsloth/GLM-5.3-Flash-GGUF:UD-IQ3_XXS",
      "present": true,
      "recipe_sha256": "82d10ffdaa95a99ddec273b3018d4508aae460c6f401aeaf2ea92da15840c93a",
      "attempted": false,
      "ever_started_successfully": false,
      "last_attempt_started_at": null,
      "last_successful_start_at": null,
      "last_stop_at": null,
      "attempts": [],
      "notes": [],
      "recipe_changes": []
    },
    "local-recipes/glm-5.3-flash-ud-q2-k-xl-no-mtp.yaml": {
      "source": "local",
      "recipe_path": "local-recipes/glm-5.3-flash-ud-q2-k-xl-no-mtp.yaml",
      "recipe_name": "GLM-5.3-Flash-UD-Q2_K_XL-No-MTP",
      "model": "unsloth/GLM-5.3-Flash-GGUF:UD-Q2_K_XL",
      "present": true,
      "recipe_sha256": "88d7eaf0bbc102d96d14edcd01ebf179c01804df9b5f0c46ff8d8d35f60b84b4",
      "attempted": false,
      "ever_started_successfully": false,
      "last_attempt_started_at": null,
      "last_successful_start_at": null,
      "last_stop_at": null,
      "attempts": [],
      "notes": [],
      "recipe_changes": []
    },
    "local-recipes/glm-5.3-flash-ud-q2-k-xl.yaml": {
      "source": "local",
      "recipe_path": "local-recipes/glm-5.3-flash-ud-q2-k-xl.yaml",
      "recipe_name": "GLM-5.3-Flash-UD-Q2_K_XL",
      "model": "unsloth/GLM-5.3-Flash-GGUF:UD-Q2_K_XL",
      "present": true,
      "recipe_sha256": "88b1b72e4a7ddab8fbd1262b26de51fd356ea698b3991231b21321b2c94c01fd",
      "attempted": false,
      "ever_started_successfully": false,
      "last_attempt_started_at": null,
      "last_successful_start_at": null,
      "last_stop_at": null,
      "attempts": [],
      "notes": [],
      "recipe_changes": []
    },
    "local-recipes/gpt-oss-120b-mxfp4.yaml": {
      "source": "local",
      "recipe_path": "local-recipes/gpt-oss-120b-mxfp4.yaml",
      "recipe_name": "OpenAI GPT-OSS 120B MXFP4 (Local)",
      "model": "openai/gpt-oss-120b",
      "present": false,
      "recipe_sha256": "9bc6ac72c1bfb4c3c12744f8c63e93abc5c43eabf5c73d9477452c4f41b47a59",
      "attempted": true,
      "ever_started_successfully": true,
      "last_attempt_started_at": "2026-09-13T06:40:10Z",
      "last_successful_start_at": "2026-09-14T04:55:32Z",
      "last_stop_at": "2026-09-14T04:55:32Z",
      "attempts": [
        {
          "id": "attempt-0001",
          "recorded_at": "2026-09-13T06:40:10Z",
          "started_at": "2026-09-13T06:40:10Z",
          "started_at_is_approximate": false,
          "ready_at": "2026-09-14T04:55:32Z",
          "stopped_at": "2026-09-14T04:55:32Z",
          "ended_at": "2026-09-14T04:55:32Z",
          "status": "stopped-externally",
          "successful_start": true,
          "parameters": {
            "port": 8000,
            "setup": true
          },
          "recipe_sha256": "9bc6ac72c1bfb4c3c12744f8c63e93abc5c43eabf5c73d9477452c4f41b47a59",
          "git_revision": "f04725482c6e45f5a9510eb12a7f1525d431edc3",
          "recipe_dirty": false,
          "failure_reason": null,
          "stop_reason": "Historical successful run and clean stop reconstructed from retained runner scrollback; structured stop time is the later observation time.",
          "stop_time_is_observation": true,
          "notes": [
            {
              "recorded_at": "2026-09-14T04:55:32Z",
              "text": "Retained runner logs show the API became ready at 2026-09-13 08:02:43 America/Los_Angeles after loading 61.2510 GiB in 24.24 seconds; test traffic completed successfully and logs reported generation throughput up to 59.5 tokens/s. The server was stopped cleanly at 08:07:43 local time."
            }
          ],
          "metrics": []
        }
      ],
      "notes": [
        {
          "recorded_at": "2026-09-14T04:55:45Z",
          "text": "Retired this redundant local definition after verifying it matched the upstream recipes/openai-gpt-oss-120b.yaml configuration; future launches should use the upstream recipe."
        }
      ],
      "recipe_changes": [
        {
          "recorded_at": "2026-09-13T06:38:18Z",
          "description": "Added a local single-DGX Spark GPT-OSS 120B recipe mirroring the optimized upstream CUTLASS MXFP4 and FlashInfer configuration on port 8000.",
          "previous_recipe_sha256": null,
          "recipe_sha256": "9bc6ac72c1bfb4c3c12744f8c63e93abc5c43eabf5c73d9477452c4f41b47a59",
          "git_revision": "4535f8a1156991024a9079eccae66516e066744c"
        }
      ]
    },
    "local-recipes/ling-3.0-flash-vl-fp4.yaml": {
      "source": "local",
      "recipe_path": "local-recipes/ling-3.0-flash-vl-fp4.yaml",
      "recipe_name": "Ling-3.0-Flash-VL-FP4",
      "model": "inclusionAI/Ling-3.0-flash-VL-fp4",
      "present": false,
      "recipe_sha256": "61612f1eb119eccb416251a8a93df8ed2bf3afd08c2b028eb1714a2d68f4ce7f",
      "attempted": true,
      "ever_started_successfully": false,
      "last_attempt_started_at": "2026-09-11T06:08:48Z",
      "last_successful_start_at": null,
      "last_stop_at": null,
      "attempts": [
        {
          "id": "attempt-0001",
          "recorded_at": "2026-09-11T05:48:56Z",
          "started_at": "2026-09-11T05:48:56Z",
          "started_at_is_approximate": false,
          "ready_at": null,
          "stopped_at": null,
          "ended_at": "2026-09-11T05:50:53Z",
          "status": "failed",
          "successful_start": false,
          "parameters": {
            "port": 8000,
            "setup": false
          },
          "recipe_sha256": "61612f1eb119eccb416251a8a93df8ed2bf3afd08c2b028eb1714a2d68f4ce7f",
          "git_revision": "496f5171b37b49c412ce1a614990dd87c0446a1a",
          "recipe_dirty": false,
          "failure_reason": "Trusted multimodal processor requires missing runtime package decord",
          "stop_reason": null,
          "stop_time_is_observation": false,
          "notes": [],
          "metrics": []
        },
        {
          "id": "attempt-0002",
          "recorded_at": "2026-09-11T06:05:16Z",
          "started_at": "2026-09-11T06:05:16Z",
          "started_at_is_approximate": false,
          "ready_at": null,
          "stopped_at": null,
          "ended_at": "2026-09-11T06:06:40Z",
          "status": "failed",
          "successful_start": false,
          "parameters": {
            "port": 8000,
            "setup": false
          },
          "recipe_sha256": "61612f1eb119eccb416251a8a93df8ed2bf3afd08c2b028eb1714a2d68f4ce7f",
          "git_revision": "c775835098f555251236282f4805d0b584a86483",
          "recipe_dirty": false,
          "failure_reason": "Transformers dynamic module cache omitted bailingmm_utils_video.py relative import",
          "stop_reason": null,
          "stop_time_is_observation": false,
          "notes": [
            {
              "recorded_at": "2026-09-11T06:05:16Z",
              "text": "Retry with ARM64 decord2 runtime compatibility package"
            }
          ],
          "metrics": []
        },
        {
          "id": "attempt-0003",
          "recorded_at": "2026-09-11T06:08:48Z",
          "started_at": "2026-09-11T06:08:48Z",
          "started_at_is_approximate": false,
          "ready_at": null,
          "stopped_at": null,
          "ended_at": "2026-09-11T06:15:09Z",
          "status": "failed",
          "successful_start": false,
          "parameters": {
            "port": 8000,
            "setup": false
          },
          "recipe_sha256": "61612f1eb119eccb416251a8a93df8ed2bf3afd08c2b028eb1714a2d68f4ce7f",
          "git_revision": "419e5e444c0b9b644479e9b0e950f98a23e57243",
          "recipe_dirty": false,
          "failure_reason": "FP4 DeepGEMM E8M0 runtime exhausted 128 GB device address space while loading weights",
          "stop_reason": null,
          "stop_time_is_observation": false,
          "notes": [
            {
              "recorded_at": "2026-09-11T06:08:48Z",
              "text": "Retry after preserving and clearing partial Transformers module cache"
            }
          ],
          "metrics": []
        }
      ],
      "notes": [
        {
          "recorded_at": "2026-09-11T06:15:22Z",
          "text": "Not suitable for one 128 GB DGX Spark with the official vLLM DeepGEMM path; pivoted to INT4 compressed-tensors after measured load-time OOM"
        }
      ],
      "recipe_changes": [
        {
          "recorded_at": "2026-09-11T05:58:13Z",
          "description": "Added pinned ARM64 decord2 runtime compatibility package to the selected image build",
          "previous_recipe_sha256": "61612f1eb119eccb416251a8a93df8ed2bf3afd08c2b028eb1714a2d68f4ce7f",
          "recipe_sha256": "61612f1eb119eccb416251a8a93df8ed2bf3afd08c2b028eb1714a2d68f4ce7f",
          "git_revision": "6221c6af0ab852d9cd74353a1f5c81549873ad6f"
        }
      ]
    },
    "local-recipes/ling-3.0-flash-vl-int4.yaml": {
      "source": "local",
      "recipe_path": "local-recipes/ling-3.0-flash-vl-int4.yaml",
      "recipe_name": "Ling-3.0-Flash-VL-INT4",
      "model": "inclusionAI/Ling-3.0-flash-VL-int4",
      "present": true,
      "recipe_sha256": "5cd9355092f83b8ee943f04a3513301eb1556a40215aa9704172a05f9d2cd4d7",
      "attempted": true,
      "ever_started_successfully": true,
      "last_attempt_started_at": "2026-09-11T07:19:29Z",
      "last_successful_start_at": "2026-09-11T07:26:26Z",
      "last_stop_at": "2026-09-13T06:36:08Z",
      "attempts": [
        {
          "id": "attempt-0001",
          "recorded_at": "2026-09-11T06:29:31Z",
          "started_at": "2026-09-11T06:29:31Z",
          "started_at_is_approximate": false,
          "ready_at": "2026-09-11T06:36:54Z",
          "stopped_at": "2026-09-11T07:19:20Z",